"ID","ISDELETED","NAME","CREATEDDATE","CREATEDBYID","LASTMODIFIEDDATE","LASTMODIFIEDBYID","SYSTEMMODSTAMP","QUESTION__C","COLOR__C","RATING_DESCRIPTION__C","RATING__C","SCORE__C","QT__C","SHOW_EXTRA_FIELDS__C","SHOW_THESE_FIELDS__C","SORT_ORDER__C"
"a0Y110000008xsiEAA","false","4476","2014-02-28T00:25:27.000Z","005U0000001BHukIAG","2014-02-28T00:25:27.000Z","005U0000001BHukIAG","2014-02-28T00:25:27.000Z","a0Z11000000D35YEAS","green","This rating is given to a child with no evidence of hyperarousal symptoms.","0","0.0","HYPERAROUSAL","false","",""
"a0Y110000008xsjEAA","false","4477","2014-02-28T00:25:27.000Z","005U0000001BHukIAG","2014-02-28T00:25:27.000Z","005U0000001BHukIAG","2014-02-28T00:25:27.000Z","a0Z11000000D35YEAS","yellow","This rating is given to a child who exhibits mild hyperarousal that does not significantly interfere with his or her day-to-day functioning. Children may also occasionally manifest physical symptoms such as stomach-aches and headaches.","1","1.0","HYPERAROUSAL","false","",""
"a0Y110000008xskEAA","false","4478","2014-02-28T00:25:27.000Z","005U0000001BHukIAG","2014-02-28T00:25:27.000Z","005U0000001BHukIAG","2014-02-28T00:25:27.000Z","a0Z11000000D35YEAS","orange","This rating is given to a child with moderate symptoms of hyperarousal or alterations in arousal and reactivity associated with traumatic event(s). The child may exhibit one significant symptom or a combination of two or more of the following symptoms: difficulty falling or staying asleep, irritability or outbursts of anger, difficulty concentrating, hypervigilance and/or exaggerated startle response.  Children may also commonly manifest physical mptoms such as stomach-aches and headaches.","2","2.0","HYPERAROUSAL","false","",""
"a0Y110000008xslEAA","false","4479","2014-02-28T00:25:27.000Z","005U0000001BHukIAG","2014-02-28T00:25:27.000Z","005U0000001BHukIAG","2014-02-28T00:25:27.000Z","a0Z11000000D35YEAS","red","This rating is given to a child who exhibits multiple and or severe hyperarousal symptoms including alterations in arousal and reactivity associated with traumatic event(s). These may include difficulty falling or staying asleep, irritability or outbursts of anger, difficulty concentrating, hypervigilance and/or exaggerated startle response. The intensity or frequency of these symptoms are distressing for the child and lead to frequent problems with day-to-day functioning.","3","6.0","HYPERAROUSAL","false","",""
"a0Y110000008xsmEAA","false","4480","2014-02-28T00:25:27.000Z","005U0000001BHukIAG","2014-02-28T00:25:27.000Z","005U0000001BHukIAG","2014-02-28T00:25:27.000Z","a0Z11000000D35ZEAS","green","This rating is given to a child with no evidence of avoidance symptoms.","0","0.0","AVOIDANCE","false","",""
"a0Y110000008xsnEAA","false","4481","2014-02-28T00:25:27.000Z","005U0000001BHukIAG","2014-02-28T00:25:27.000Z","005U0000001BHukIAG","2014-02-28T00:25:27.000Z","a0Z11000000D35ZEAS","yellow","This rating is given to a child who exhibits some avoidance. This child may exhibit one primary avoidant symptom, including efforts to avoid thoughts, feelings or conversations associated with the trauma.","1","1.0","AVOIDANCE","false","",""
"a0Y110000008xsoEAA","false","4482","2014-02-28T00:25:27.000Z","005U0000001BHukIAG","2014-02-28T00:25:27.000Z","005U0000001BHukIAG","2014-02-28T00:25:27.000Z","a0Z11000000D35ZEAS","orange","This rating is given to a child with moderate symptoms of avoidance. In addition to avoiding thoughts or feelings associated with the trauma, the child may also avoid activities, places, or people that arouse recollections of the trauma.","2","2.0","AVOIDANCE","false","",""
"a0Y110000008xspEAA","false","4483","2014-02-28T00:25:27.000Z","005U0000001BHukIAG","2014-02-28T00:25:27.000Z","005U0000001BHukIAG","2014-02-28T00:25:27.000Z","a0Z11000000D35ZEAS","red","This rating is given to a child who exhibits significant or multiple avoidant symptoms. This child may avoid thoughts and feelings as well as situations and people associated with the trauma and be unable to recall important aspects of the trauma.","3","6.0","AVOIDANCE","false","",""
"a0Y110000008xi0EAA","false","3812","2014-02-28T00:24:44.000Z","005U0000001BHukIAG","2014-02-28T00:24:44.000Z","005U0000001BHukIAG","2014-02-28T00:24:44.000Z","a0Z11000000D32aEAC","","","Presents a Risk","","Medication(s)","true","Description_of_Risk__c,Plan_to_reduce_Risk__c","1.0"
"a0Y110000008xi1EAA","false","3813","2014-02-28T00:24:44.000Z","005U0000001BHukIAG","2014-02-28T00:24:44.000Z","005U0000001BHukIAG","2014-02-28T00:24:44.000Z","a0Z11000000D32aEAC","","","Does Not Present a Risk","","Medication(s)","false","","2.0"
"a0Y110000008xi2EAA","false","3814","2014-02-28T00:24:44.000Z","005U0000001BHukIAG","2014-02-28T00:24:44.000Z","005U0000001BHukIAG","2014-02-28T00:24:44.000Z","a0Z11000000D32bEAC","","","Presents a Risk","","Food","true","Description_of_Risk__c,Plan_to_reduce_Risk__c","1.0"
"a0Y110000008xi3EAA","false","3815","2014-02-28T00:24:44.000Z","005U0000001BHukIAG","2014-02-28T00:24:44.000Z","005U0000001BHukIAG","2014-02-28T00:24:44.000Z","a0Z11000000D32bEAC","","","Does Not Present a Risk","","Food","false","","2.0"
"a0Y110000008xi4EAA","false","3816","2014-02-28T00:24:44.000Z","005U0000001BHukIAG","2014-02-28T00:24:44.000Z","005U0000001BHukIAG","2014-02-28T00:24:44.000Z","a0Z11000000D32cEAC","","","Presents a Risk","","Environmental","true","Description_of_Risk__c,Plan_to_reduce_Risk__c","1.0"
"a0Y110000008xi5EAA","false","3817","2014-02-28T00:24:44.000Z","005U0000001BHukIAG","2014-02-28T00:24:44.000Z","005U0000001BHukIAG","2014-02-28T00:24:44.000Z","a0Z11000000D32cEAC","","","Does Not Present a Risk","","Environmental","false","","2.0"
"a0Y110000008xi6EAA","false","3818","2014-02-28T00:24:44.000Z","005U0000001BHukIAG","2014-02-28T00:24:44.000Z","005U0000001BHukIAG","2014-02-28T00:24:44.000Z","a0Z11000000D32dEAC","","","Presents a Risk","","Other","true","Description_of_Risk__c,Plan_to_reduce_Risk__c","1.0"
"a0Y110000008xi7EAA","false","3819","2014-02-28T00:24:44.000Z","005U0000001BHukIAG","2014-02-28T00:24:44.000Z","005U0000001BHukIAG","2014-02-28T00:24:44.000Z","a0Z11000000D32dEAC","","","Does Not Present a Risk","","Other","false","","2.0"
"a0Y110000008xi8EAA","false","3820","2014-02-28T00:24:44.000Z","005U0000001BHukIAG","2014-02-28T00:24:44.000Z","005U0000001BHukIAG","2014-02-28T00:24:44.000Z","a0Z11000000D32eEAC","","","Presents a Risk","","Hurts others","true","Description_of_Risk__c,Plan_to_reduce_Risk__c","1.0"
"a0Y110000008xi9EAA","false","3821","2014-02-28T00:24:44.000Z","005U0000001BHukIAG","2014-02-28T00:24:44.000Z","005U0000001BHukIAG","2014-02-28T00:24:44.000Z","a0Z11000000D32eEAC","","","Does Not Present a Risk","","Hurts others","false","","2.0"
"a0Y110000008xiUEAQ","false","3842","2014-02-28T00:24:45.000Z","005U0000001BHukIAG","2014-02-28T00:24:45.000Z","005U0000001BHukIAG","2014-02-28T00:24:45.000Z","a0Z11000000D32nEAC","yellow","Caregiver(s) has some mental health limitations that interfere with provision of assistance or attendant care.","1","1.0","MENTAL HEALTH","false","",""
"a0Y110000008xiVEAQ","false","3843","2014-02-28T00:24:45.000Z","005U0000001BHukIAG","2014-02-28T00:24:45.000Z","005U0000001BHukIAG","2014-02-28T00:24:45.000Z","a0Z11000000D32nEAC","orange","Caregiver(s) has significant mental health limitations that prevent them from being able to provide some needed assistance or make attendant care difficult.","2","2.0","MENTAL HEALTH","false","",""
"a0Y110000008xiWEAQ","false","3844","2014-02-28T00:24:45.000Z","005U0000001BHukIAG","2014-02-28T00:24:45.000Z","005U0000001BHukIAG","2014-02-28T00:24:45.000Z","a0Z11000000D32nEAC","red","Caregiver(s) is unable to provide any needed assistance or attendant care due to serious mental illness.","3","6.0","MENTAL HEALTH","false","",""
"a0Y110000008xiXEAQ","false","3845","2014-02-28T00:24:45.000Z","005U0000001BHukIAG","2014-02-28T00:24:45.000Z","005U0000001BHukIAG","2014-02-28T00:24:45.000Z","a0Z11000000D32nEAC","gray","Rate non applicable when the child has no known caregiver and/or when child is living in a residential or group home setting.","NA","0.0","MENTAL HEALTH","false","",""
"a0Y110000008xiYEAQ","false","3846","2014-02-28T00:24:45.000Z","005U0000001BHukIAG","2014-02-28T00:24:45.000Z","005U0000001BHukIAG","2014-02-28T00:24:45.000Z","a0Z11000000D32oEAC","green","Caregiver(s) has no substance-related limitations that impact assistance or attendant care.","0","0.0","SUBSTANCE USE","false","",""
"a0Y110000008xiZEAQ","false","3847","2014-02-28T00:24:45.000Z","005U0000001BHukIAG","2014-02-28T00:24:45.000Z","005U0000001BHukIAG","2014-02-28T00:24:45.000Z","a0Z11000000D32oEAC","yellow","Caregiver(s) has some substance-related limitations that interfere with provision of assistance or attendant care.","1","1.0","SUBSTANCE USE","false","",""
"a0Y110000008xiaEAA","false","3848","2014-02-28T00:24:45.000Z","005U0000001BHukIAG","2014-02-28T00:24:45.000Z","005U0000001BHukIAG","2014-02-28T00:24:45.000Z","a0Z11000000D32oEAC","orange","Caregiver(s) has significant substance-related limitations that prevent them from being able to provide some needed assistance or make attendant care difficult.","2","2.0","SUBSTANCE USE","false","",""
"a0Y110000008xibEAA","false","3849","2014-02-28T00:24:45.000Z","005U0000001BHukIAG","2014-02-28T00:24:45.000Z","005U0000001BHukIAG","2014-02-28T00:24:45.000Z","a0Z11000000D32oEAC","red","Caregiver(s) is unable to provide any needed assistance or attendant care due to serious substance dependency or abuse.","3","6.0","SUBSTANCE USE","false","",""
"a0Y110000008xicEAA","false","3850","2014-02-28T00:24:45.000Z","005U0000001BHukIAG","2014-02-28T00:24:45.000Z","005U0000001BHukIAG","2014-02-28T00:24:45.000Z","a0Z11000000D32oEAC","gray","Rate non applicable when the child has no known caregiver and/or when child is living in a residential or group home setting.","NA","0.0","SUBSTANCE USE","false","",""
"a0Y110000008xidEAA","false","3851","2014-02-28T00:24:45.000Z","005U0000001BHukIAG","2014-02-28T00:24:45.000Z","005U0000001BHukIAG","2014-02-28T00:24:45.000Z","a0Z11000000D32pEAC","green","Caregiver(s) has no developmental limitations that impact assistance or attendant care.","0","0.0","DEVELOPMENTAL","false","",""
"a0Y110000008xiyEAA","false","3872","2014-02-28T00:24:47.000Z","005U0000001BHukIAG","2014-02-28T00:24:47.000Z","005U0000001BHukIAG","2014-02-28T00:24:47.000Z","a0Z11000000D32tEAC","yellow","Caregiver(s) has minimal difficulties with organizing or maintaining household to support needed services. For example, may be forgetful about appointments or occasionally fails to call back case manager.","1","1.0","ORGANIZATION","false","",""
"a0Y110000008xizEAA","false","3873","2014-02-28T00:24:47.000Z","005U0000001BHukIAG","2014-02-28T00:24:47.000Z","005U0000001BHukIAG","2014-02-28T00:24:47.000Z","a0Z11000000D32tEAC","orange","Caregiver(s) has moderate difficulty organizing or maintaining household to support needed services.","2","2.0","ORGANIZATION","false","",""
"a0Y110000008xj0EAA","false","3874","2014-02-28T00:24:47.000Z","005U0000001BHukIAG","2014-02-28T00:24:47.000Z","005U0000001BHukIAG","2014-02-28T00:24:47.000Z","a0Z11000000D32tEAC","red","Caregiver(s) is unable to organize household to support needed services.","3","6.0","ORGANIZATION","false","",""
"a0Y110000008xj1EAA","false","3875","2014-02-28T00:24:47.000Z","005U0000001BHukIAG","2014-02-28T00:24:47.000Z","005U0000001BHukIAG","2014-02-28T00:24:47.000Z","a0Z11000000D32tEAC","gray","Rate non applicable when the child has no known caregiver and/or when child is living in a residential or group home setting.","NA","0.0","ORGANIZATION","false","",""
"a0Y110000008xj2EAA","false","3876","2014-02-28T00:24:47.000Z","005U0000001BHukIAG","2014-02-28T00:24:47.000Z","005U0000001BHukIAG","2014-02-28T00:24:47.000Z","a0Z11000000D32uEAC","green","Caregiver(s) has sufficient resources so that there are few limitations on what can be provided for the child.","0","0.0","RESOURCES","false","",""
"a0Y110000008xj3EAA","false","3877","2014-02-28T00:24:47.000Z","005U0000001BHukIAG","2014-02-28T00:24:47.000Z","005U0000001BHukIAG","2014-02-28T00:24:47.000Z","a0Z11000000D32uEAC","yellow","Caregiver(s) has the necessary resources to help address the child's major and basic needs but those resources might be stretched.","1","1.0","RESOURCES","false","",""
"a0Y110000008xj4EAA","false","3878","2014-02-28T00:24:47.000Z","005U0000001BHukIAG","2014-02-28T00:24:47.000Z","005U0000001BHukIAG","2014-02-28T00:24:47.000Z","a0Z11000000D32uEAC","orange","Caregiver(s) has limited resources (e.g., a grandmother living in same town who is sometimes available to watch the child).","2","2.0","RESOURCES","false","",""
"a0Y110000008xj5EAA","false","3879","2014-02-28T00:24:47.000Z","005U0000001BHukIAG","2014-02-28T00:24:47.000Z","005U0000001BHukIAG","2014-02-28T00:24:47.000Z","a0Z11000000D32uEAC","red","Caregiver(s) has severely limited resources that are available to assist in the care and treatment of the child.","3","6.0","RESOURCES","false","",""
"a0Y110000008xj6EAA","false","3880","2014-02-28T00:24:47.000Z","005U0000001BHukIAG","2014-02-28T00:24:47.000Z","005U0000001BHukIAG","2014-02-28T00:24:47.000Z","a0Z11000000D32uEAC","gray","Rate non applicable when the child has no known caregiver and/or when child is living in a residential or group home setting.","NA","0.0","RESOURCES","false","",""
"a0Y110000008xj7EAA","false","3881","2014-02-28T00:24:47.000Z","005U0000001BHukIAG","2014-02-28T00:24:47.000Z","005U0000001BHukIAG","2014-02-28T00:24:47.000Z","a0Z11000000D32vEAC","green","This rating indicates a family/caregiver in stable housing with no known risks of instability.","0","0.0","RESIDENTIAL STABILITY","false","",""
"a0Y110000008xjSEAQ","false","3902","2014-02-28T00:24:49.000Z","005U0000001BHukIAG","2014-02-28T00:24:49.000Z","005U0000001BHukIAG","2014-02-28T00:24:49.000Z","a0Z11000000D32xEAC","red","Profound level of caregiver or marital violence that often escalates to mutual attacks or the use of physical aggression by one partner to control the other. These episodes may exacerbate child?s difficulties or put the child at greater risk.","3","6.0","MARITAL/PARTNER VIOLENCE","false","",""
"a0Y110000008xjTEAQ","false","3903","2014-02-28T00:24:49.000Z","005U0000001BHukIAG","2014-02-28T00:24:49.000Z","005U0000001BHukIAG","2014-02-28T00:24:49.000Z","a0Z11000000D32xEAC","gray","Rate non applicable when the child has no known caregiver and/or when child is living in a residential or group home setting.","NA","0.0","MARITAL/PARTNER VIOLENCE","false","",""
"a0Y110000008xjUEAQ","false","3904","2014-02-28T00:24:49.000Z","005U0000001BHukIAG","2014-02-28T00:24:49.000Z","005U0000001BHukIAG","2014-02-28T00:24:49.000Z","a0Z11000000D32XEAS","orange","Child experiences significant barriers and is sometimes prevented from practicing rituals consistent with his/her cultural identity.","2","2.0","RITUAL","false","",""
"a0Y110000008xjVEAQ","false","3905","2014-02-28T00:24:49.000Z","005U0000001BHukIAG","2014-02-28T00:24:49.000Z","005U0000001BHukIAG","2014-02-28T00:24:49.000Z","a0Z11000000D32XEAS","red","Child is unable to practice rituals consistent with his/her cultural identity.","3","6.0","RITUAL","false","",""
"a0Y110000008xjWEAQ","false","3906","2014-02-28T00:24:49.000Z","005U0000001BHukIAG","2014-02-28T00:24:49.000Z","005U0000001BHukIAG","2014-02-28T00:24:49.000Z","a0Z11000000D32XEAS","green","Child is consistently able to practice rituals consistent with his/her cultural identity.","0","0.0","RITUAL","false","",""
"a0Y110000008xjXEAQ","false","3907","2014-02-28T00:24:49.000Z","005U0000001BHukIAG","2014-02-28T00:24:49.000Z","005U0000001BHukIAG","2014-02-28T00:24:49.000Z","a0Z11000000D32XEAS","yellow","Child is generally able to practice rituals consistent with his/her cultural identity; however, he/she sometimes experiences some obstacles to the performance of these rituals.","1","1.0","RITUAL","false","",""
"a0Y110000008xjYEAQ","false","3908","2014-02-28T00:24:49.000Z","005U0000001BHukIAG","2014-02-28T00:24:49.000Z","005U0000001BHukIAG","2014-02-28T00:24:49.000Z","a0Z11000000D32yEAC","green","Caregiver has adjusted to traumatic experiences without notable posttraumatic stress reactions.","0","0.0","CAREGIVER POSTTRAUMATIC REACTIONS","false","",""
"a0Y110000008xjZEAQ","false","3909","2014-02-28T00:24:49.000Z","005U0000001BHukIAG","2014-02-28T00:24:49.000Z","005U0000001BHukIAG","2014-02-28T00:24:49.000Z","a0Z11000000D32yEAC","yellow","Caregiver has some mild adjustment problems related to their child?s or their own traumatic experiences. Caregiver may exhibit some guilt about their child?s trauma or become somewhat detached or estranged from others.","1","1.0","CAREGIVER POSTTRAUMATIC REACTIONS","false","",""
"a0Y110000008xjaEAA","false","3910","2014-02-28T00:24:49.000Z","005U0000001BHukIAG","2014-02-28T00:24:49.000Z","005U0000001BHukIAG","2014-02-28T00:24:49.000Z","a0Z11000000D32yEAC","orange","Caregiver has moderate adjustment difficulties related to traumatic experiences. Caregiver may have nightmares or flashbacks of the trauma.","2","2.0","CAREGIVER POSTTRAUMATIC REACTIONS","false","",""
"a0Y110000008xjbEAA","false","3911","2014-02-28T00:24:49.000Z","005U0000001BHukIAG","2014-02-28T00:24:49.000Z","005U0000001BHukIAG","2014-02-28T00:24:49.000Z","a0Z11000000D32yEAC","red","Caregiver has significant adjustment difficulties associated with traumatic experiences. Symptoms might include intrusive thoughts, hypervigilance, and constant anxiety.","3","6.0","CAREGIVER POSTTRAUMATIC REACTIONS","false","",""
"a0Y110000008xkQEAQ","false","3962","2014-02-28T00:24:52.000Z","005U0000001BHukIAG","2014-02-28T00:24:52.000Z","005U0000001BHukIAG","2014-02-28T00:24:52.000Z","a0Z11000000D339EAC","red","This rating is given to a child with more significant regressions in behaviors in an earlier age as demonstrated by changes in speech or loss of bowel or bladder control.","3","6.0","BEHAVIORAL REGRESSIONS","false","",""
"a0Y110000008xkREAQ","false","3963","2014-02-28T00:24:52.000Z","005U0000001BHukIAG","2014-02-28T00:24:52.000Z","005U0000001BHukIAG","2014-02-28T00:24:52.000Z","a0Z11000000D33aEAC","","","Presents a Risk","","Vehicle safety (Rides in car safely/fastens seatbelt)","true","Description_of_Risk__c,Plan_to_reduce_Risk__c","1.0"
"a0Y110000008xkSEAQ","false","3964","2014-02-28T00:24:52.000Z","005U0000001BHukIAG","2014-02-28T00:24:52.000Z","005U0000001BHukIAG","2014-02-28T00:24:52.000Z","a0Z11000000D33aEAC","","","Does Not Present a Risk","","Vehicle safety (Rides in car safely/fastens seatbelt)","false","","2.0"
"a0Y110000008xkTEAQ","false","3965","2014-02-28T00:24:52.000Z","005U0000001BHukIAG","2014-02-28T00:24:52.000Z","005U0000001BHukIAG","2014-02-28T00:24:52.000Z","a0Z11000000D33AEAS","green","This rating is for a child with no evidence of somatic symptoms.","0","0.0","SOMATIZATION","false","",""
"a0Y110000008xkUEAQ","false","3966","2014-02-28T00:24:52.000Z","005U0000001BHukIAG","2014-02-28T00:24:52.000Z","005U0000001BHukIAG","2014-02-28T00:24:52.000Z","a0Z11000000D33AEAS","yellow","This rating indicates a child with a mild level of somatic problems. This could include occasional headaches, stomach problems (nausea, vomiting), joint, limb or chest pain without medical cause.","1","1.0","SOMATIZATION","false","",""
"a0Y110000008xkVEAQ","false","3967","2014-02-28T00:24:52.000Z","005U0000001BHukIAG","2014-02-28T00:24:52.000Z","005U0000001BHukIAG","2014-02-28T00:24:52.000Z","a0Z11000000D33AEAS","orange","This rating indicates a child with a moderate level of somatic problems or the presence of conversion symptoms. This could include more persistent physical symptoms without a medical cause or the presence of several different physical symptoms (e.g., stomach problems, headaches, backaches). This child may meet criteria for a somatoform disorder. Additionally, the child could manifest any conversion symptoms here (e.g., pseudoseizures, paralysis).","2","2.0","SOMATIZATION","false","",""
"a0Y110000008xkWEAQ","false","3968","2014-02-28T00:24:52.000Z","005U0000001BHukIAG","2014-02-28T00:24:52.000Z","005U0000001BHukIAG","2014-02-28T00:24:52.000Z","a0Z11000000D33AEAS","red","This rating indicates a child with severe somatic symptoms causing significant disturbance in school or social functioning. This could include significant and varied symptomatic disturbance without medical cause.","3","6.0","SOMATIZATION","false","",""
"a0Y110000008xkXEAQ","false","3969","2014-02-28T00:24:52.000Z","005U0000001BHukIAG","2014-02-28T00:24:52.000Z","005U0000001BHukIAG","2014-02-28T00:24:52.000Z","a0Z11000000D33bEAC","","","Presents a Risk","","Bike safety","true","Description_of_Risk__c,Plan_to_reduce_Risk__c","1.0"
"a0Y110000008xkYEAQ","false","3970","2014-02-28T00:24:52.000Z","005U0000001BHukIAG","2014-02-28T00:24:52.000Z","005U0000001BHukIAG","2014-02-28T00:24:52.000Z","a0Z11000000D33bEAC","","","Does Not Present a Risk","","Bike safety","false","","2.0"
"a0Y110000008xkZEAQ","false","3971","2014-02-28T00:24:52.000Z","005U0000001BHukIAG","2014-02-28T00:24:52.000Z","005U0000001BHukIAG","2014-02-28T00:24:52.000Z","a0Z11000000D33BEAS","green","This rating indicates a child with no evidence of any significant anger control problems.","0","0.0","ANGER CONTROL","false","",""
"a0Y110000008xkaEAA","false","3972","2014-02-28T00:24:53.000Z","005U0000001BHukIAG","2014-02-28T00:24:53.000Z","005U0000001BHukIAG","2014-02-28T00:24:53.000Z","a0Z11000000D33BEAS","yellow","This rating indicates a child with some problems with controlling anger. He/she may sometimes become verbally aggressive when frustrated. Peers and family members are aware of and may attempt to avoid stimulating angry outbursts. Child may have a history of physical aggression arising from inability to control anger, but none within the last 3 months.","1","1.0","ANGER CONTROL","false","",""
"a0Y110000008xkbEAA","false","3973","2014-02-28T00:24:53.000Z","005U0000001BHukIAG","2014-02-28T00:24:53.000Z","005U0000001BHukIAG","2014-02-28T00:24:53.000Z","a0Z11000000D33BEAS","orange","This rating indicates a child with moderate anger control problems. His/her temper has gotten him/her in significant trouble with peers, family, and/or school. This level may be associated with some physical violence, or increasing verbal outbursts. Others are likely quite aware of anger potential.","2","2.0","ANGER CONTROL","false","",""
"a0Y110000008xkcEAA","false","3974","2014-02-28T00:24:53.000Z","005U0000001BHukIAG","2014-02-28T00:24:53.000Z","005U0000001BHukIAG","2014-02-28T00:24:53.000Z","a0Z11000000D33BEAS","red","This rating indicates a child with severe anger control problems. His/her temper is likely associated with frequent fighting that is often physical. Others likely fear him/her.","3","6.0","ANGER CONTROL","false","",""
"a0Y110000008xkdEAA","false","3975","2014-02-28T00:24:53.000Z","005U0000001BHukIAG","2014-02-28T00:24:53.000Z","005U0000001BHukIAG","2014-02-28T00:24:53.000Z","a0Z11000000D33cEAC","","","Presents a Risk","","Reasonable caution w/strangers","true","Description_of_Risk__c,Plan_to_reduce_Risk__c","1.0"
"a0Y110000008xkeEAA","false","3976","2014-02-28T00:24:53.000Z","005U0000001BHukIAG","2014-02-28T00:24:53.000Z","005U0000001BHukIAG","2014-02-28T00:24:53.000Z","a0Z11000000D33cEAC","","","Does Not Present a Risk","","Reasonable caution w/strangers","false","","2.0"
"a0Y110000008xkfEAA","false","3977","2014-02-28T00:24:53.000Z","005U0000001BHukIAG","2014-02-28T00:24:53.000Z","005U0000001BHukIAG","2014-02-28T00:24:53.000Z","a0Z11000000D33CEAS","green","Child has no evidence or history of suicidal ideation or behaviors.","0","0.0","SUICIDE RISK","false","",""
"a0Y110000008xkgEAA","false","3978","2014-02-28T00:24:53.000Z","005U0000001BHukIAG","2014-02-28T00:24:53.000Z","005U0000001BHukIAG","2014-02-28T00:24:53.000Z","a0Z11000000D33CEAS","yellow","History of suicidal behaviors or significant ideation but none during the past 30 days.","1","1.0","SUICIDE RISK","false","",""
"a0Y110000008xkhEAA","false","3979","2014-02-28T00:24:53.000Z","005U0000001BHukIAG","2014-02-28T00:24:53.000Z","005U0000001BHukIAG","2014-02-28T00:24:53.000Z","a0Z11000000D33CEAS","orange","Recent, (last 30 days) but not acute (today) suicidal ideation or gesture.","2","2.0","SUICIDE RISK","false","",""
"a0Y110000008xkiEAA","false","3980","2014-02-28T00:24:53.000Z","005U0000001BHukIAG","2014-02-28T00:24:53.000Z","005U0000001BHukIAG","2014-02-28T00:24:53.000Z","a0Z11000000D33CEAS","red","Current suicidal ideation and intent in the past 24 hours.","3","6.0","SUICIDE RISK","false","",""
"a0Y110000008xkjEAA","false","3981","2014-02-28T00:24:53.000Z","005U0000001BHukIAG","2014-02-28T00:24:53.000Z","005U0000001BHukIAG","2014-02-28T00:24:53.000Z","a0Z11000000D33dEAC","","","Presents a Risk","","Relates personal I.D. information","true","Description_of_Risk__c,Plan_to_reduce_Risk__c","1.0"
"a0Y110000008xkkEAA","false","3982","2014-02-28T00:24:54.000Z","005U0000001BHukIAG","2014-02-28T00:24:54.000Z","005U0000001BHukIAG","2014-02-28T00:24:54.000Z","a0Z11000000D33dEAC","","","Does Not Present a Risk","","Relates personal I.D. information","false","","2.0"
"a0Y110000008xklEAA","false","3983","2014-02-28T00:24:54.000Z","005U0000001BHukIAG","2014-02-28T00:24:54.000Z","005U0000001BHukIAG","2014-02-28T00:24:54.000Z","a0Z11000000D33DEAS","green","No evidence of any forms of self-injury (e.g., cutting, burning, face slapping, head banging)","0","0.0","NON-SUICIDAL SELF-INJURY","false","",""
"a0Y110000008xkmEAA","false","3984","2014-02-28T00:24:54.000Z","005U0000001BHukIAG","2014-02-28T00:24:54.000Z","005U0000001BHukIAG","2014-02-28T00:24:54.000Z","a0Z11000000D33DEAS","yellow","History of self-injury but none evident in the past 30 days.","1","1.0","NON-SUICIDAL SELF-INJURY","false","",""
