"ID","ISDELETED","NAME","CREATEDDATE","CREATEDBYID","LASTMODIFIEDDATE","LASTMODIFIEDBYID","SYSTEMMODSTAMP","QUESTION__C","COLOR__C","RATING_DESCRIPTION__C","RATING__C","SCORE__C","QT__C","SHOW_EXTRA_FIELDS__C","SHOW_THESE_FIELDS__C","SORT_ORDER__C"
"a0Y110000008xoiEAA","false","4228","2014-02-28T00:25:10.000Z","005U0000001BHukIAG","2014-02-28T00:25:10.000Z","005U0000001BHukIAG","2014-02-28T00:25:10.000Z","a0Z11000000D34MEAS","green","Child has no current health problems or chronic conditions.","0","0.0","MEDICAL","false","",""
"a0Y110000008xojEAA","false","4229","2014-02-28T00:25:10.000Z","005U0000001BHukIAG","2014-02-28T00:25:10.000Z","005U0000001BHukIAG","2014-02-28T00:25:10.000Z","a0Z11000000D34MEAS","yellow","Child has mild/treatable medical problems that require medical treatment.","1","1.0","MEDICAL","false","",""
"a0Y110000008xokEAA","false","4230","2014-02-28T00:25:10.000Z","005U0000001BHukIAG","2014-02-28T00:25:10.000Z","005U0000001BHukIAG","2014-02-28T00:25:10.000Z","a0Z11000000D34MEAS","orange","Child has chronic illness that requires ongoing medical intervention.","2","2.0","MEDICAL","false","",""
"a0Y110000008xolEAA","false","4231","2014-02-28T00:25:10.000Z","005U0000001BHukIAG","2014-02-28T00:25:10.000Z","005U0000001BHukIAG","2014-02-28T00:25:10.000Z","a0Z11000000D34MEAS","red","Child has life threatening illness or medical condition.","3","6.0","MEDICAL","false","",""
"a0Y110000008xpGEAQ","false","4262","2014-02-28T00:25:13.000Z","005U0000001BHukIAG","2014-02-28T00:25:13.000Z","005U0000001BHukIAG","2014-02-28T00:25:13.000Z","a0Z11000000D34REAS","red","Child is having severe achievement problems. He/she may be failing most subjects or is more than one year behind same age peers in school achievement, and/or will certainly not pass to next grade level.","3","6.0","SCHOOL ACHIEVEMENT","false","",""
"a0Y110000008xpHEAQ","false","4263","2014-02-28T00:25:13.000Z","005U0000001BHukIAG","2014-02-28T00:25:13.000Z","005U0000001BHukIAG","2014-02-28T00:25:13.000Z","a0Z11000000D34REAS","gray","Not applicable for children three years and younger or any other child not expected to be in school.","NA","0.0","SCHOOL ACHIEVEMENT","false","",""
"a0Y110000008xpIEAQ","false","4264","2014-02-28T00:25:13.000Z","005U0000001BHukIAG","2014-02-28T00:25:13.000Z","005U0000001BHukIAG","2014-02-28T00:25:13.000Z","a0Z11000000D34sEAC","","","Presents a Risk","","Creeks, ditches, wooded areas","true","Description_of_Risk__c,Plan_to_reduce_Risk__c","1.0"
"a0Y110000008xpJEAQ","false","4265","2014-02-28T00:25:13.000Z","005U0000001BHukIAG","2014-02-28T00:25:13.000Z","005U0000001BHukIAG","2014-02-28T00:25:13.000Z","a0Z11000000D34sEAC","","","Does Not Present a Risk","","Creeks, ditches, wooded areas","false","","2.0"
"a0Y110000008xpKEAQ","false","4266","2014-02-28T00:25:13.000Z","005U0000001BHukIAG","2014-02-28T00:25:13.000Z","005U0000001BHukIAG","2014-02-28T00:25:13.000Z","a0Z11000000D34SEAS","green","No evidence of attendance problems. Child attends regularly.","0","0.0","SCHOOL ATTENDANCE","false","",""
"a0Y110000008xpLEAQ","false","4267","2014-02-28T00:25:13.000Z","005U0000001BHukIAG","2014-02-28T00:25:13.000Z","005U0000001BHukIAG","2014-02-28T00:25:13.000Z","a0Z11000000D34SEAS","yellow","Child has some problems attending school, although he/she generally goes to school. He/she may miss up to one day per week on average. Or, he/she may have had moderate to severe problems in the past six months but has been attending school regularly in the past month.","1","1.0","SCHOOL ATTENDANCE","false","",""
"a0Y110000008xpMEAQ","false","4268","2014-02-28T00:25:13.000Z","005U0000001BHukIAG","2014-02-28T00:25:13.000Z","005U0000001BHukIAG","2014-02-28T00:25:13.000Z","a0Z11000000D34SEAS","orange","Child is having problems with school attendance. He/she is missing at least two days per week on average.","2","2.0","SCHOOL ATTENDANCE","false","",""
"a0Y110000008xpNEAQ","false","4269","2014-02-28T00:25:13.000Z","005U0000001BHukIAG","2014-02-28T00:25:13.000Z","005U0000001BHukIAG","2014-02-28T00:25:13.000Z","a0Z11000000D34SEAS","red","Child is generally truant or refusing to go to school or a school-aged child not enrolled in school.","3","6.0","SCHOOL ATTENDANCE","false","",""
"a0Y110000008xpOEAQ","false","4270","2014-02-28T00:25:13.000Z","005U0000001BHukIAG","2014-02-28T00:25:13.000Z","005U0000001BHukIAG","2014-02-28T00:25:13.000Z","a0Z11000000D34SEAS","gray","Not applicable for children three years and younger or any other child not expected to be in school.","NA","0.0","SCHOOL ATTENDANCE","false","",""
"a0Y110000008xpPEAQ","false","4271","2014-02-28T00:25:13.000Z","005U0000001BHukIAG","2014-02-28T00:25:13.000Z","005U0000001BHukIAG","2014-02-28T00:25:13.000Z","a0Z11000000D34tEAC","","","Presents a Risk","","Fencing","true","Description_of_Risk__c,Plan_to_reduce_Risk__c","1.0"
"a0Y110000008xpaEAA","false","4282","2014-02-28T00:25:14.000Z","005U0000001BHukIAG","2014-02-28T00:25:14.000Z","005U0000001BHukIAG","2014-02-28T00:25:14.000Z","a0Z11000000D34VEAS","","","Does Not Present a Risk","","Poly-pharmacy","false","","2.0"
"a0Y110000008xpbEAA","false","4283","2014-02-28T00:25:14.000Z","005U0000001BHukIAG","2014-02-28T00:25:14.000Z","005U0000001BHukIAG","2014-02-28T00:25:14.000Z","a0Z11000000D34wEAC","","","Presents a Risk","","Railings","true","Description_of_Risk__c,Plan_to_reduce_Risk__c","1.0"
"a0Y110000008xpcEAA","false","4284","2014-02-28T00:25:14.000Z","005U0000001BHukIAG","2014-02-28T00:25:14.000Z","005U0000001BHukIAG","2014-02-28T00:25:14.000Z","a0Z11000000D34wEAC","","","Does Not Present a Risk","","Railings","false","","2.0"
"a0Y110000008xpdEAA","false","4285","2014-02-28T00:25:14.000Z","005U0000001BHukIAG","2014-02-28T00:25:14.000Z","005U0000001BHukIAG","2014-02-28T00:25:14.000Z","a0Z11000000D34WEAS","","","Presents a Risk","","Other","true","Description_of_Risk__c,Plan_to_reduce_Risk__c","1.0"
"a0Y110000008xpeEAA","false","4286","2014-02-28T00:25:14.000Z","005U0000001BHukIAG","2014-02-28T00:25:14.000Z","005U0000001BHukIAG","2014-02-28T00:25:14.000Z","a0Z11000000D34WEAS","","","Does Not Present a Risk","","Other","false","","2.0"
"a0Y110000008xpfEAA","false","4287","2014-02-28T00:25:14.000Z","005U0000001BHukIAG","2014-02-28T00:25:14.000Z","005U0000001BHukIAG","2014-02-28T00:25:14.000Z","a0Z11000000D34xEAC","","","Presents a Risk","","Specify adaptations specific to individual","true","Description_of_Risk__c,Plan_to_reduce_Risk__c","1.0"
"a0Y110000008xpgEAA","false","4288","2014-02-28T00:25:14.000Z","005U0000001BHukIAG","2014-02-28T00:25:14.000Z","005U0000001BHukIAG","2014-02-28T00:25:14.000Z","a0Z11000000D34xEAC","","","Does Not Present a Risk","","Specify adaptations specific to individual","false","","2.0"
"a0Y110000008xphEAA","false","4289","2014-02-28T00:25:14.000Z","005U0000001BHukIAG","2014-02-28T00:25:14.000Z","005U0000001BHukIAG","2014-02-28T00:25:14.000Z","a0Z11000000D34XEAS","","","Presents a Risk","","Abuses alcohol, tobacco or drugs","true","Description_of_Risk__c,Plan_to_reduce_Risk__c","1.0"
"a0Y110000008xrREAQ","false","4397","2014-02-28T00:25:21.000Z","005U0000001BHukIAG","2014-02-28T00:25:21.000Z","005U0000001BHukIAG","2014-02-28T00:25:21.000Z","a0Z11000000D35HEAS","gray","Unknown","U","0.0","SUBSTANCE EXPOSURE","false","",""
"a0Y110000008xrSEAQ","false","4398","2014-02-28T00:25:21.000Z","005U0000001BHukIAG","2014-02-28T00:25:21.000Z","005U0000001BHukIAG","2014-02-28T00:25:21.000Z","a0Z11000000D35HEAS","gray","Not applicable","NA","0.0","SUBSTANCE EXPOSURE","false","",""
"a0Y110000008xrTEAQ","false","4399","2014-02-28T00:25:21.000Z","005U0000001BHukIAG","2014-02-28T00:25:21.000Z","005U0000001BHukIAG","2014-02-28T00:25:21.000Z","a0Z11000000D35iEAC","green","Individual has a parenting/caregiving role and he/she is functioning appropriately in that role.","0","0.0","PARENTING ROLES","false","",""
"a0Y110000008xrUEAQ","false","4400","2014-02-28T00:25:21.000Z","005U0000001BHukIAG","2014-02-28T00:25:21.000Z","005U0000001BHukIAG","2014-02-28T00:25:21.000Z","a0Z11000000D35iEAC","yellow","The individual has responsibilities as a parent/caregiver but occasionally experiences difficulties with this role.","1","1.0","PARENTING ROLES","false","",""
"a0Y110000008xrVEAQ","false","4401","2014-02-28T00:25:21.000Z","005U0000001BHukIAG","2014-02-28T00:25:21.000Z","005U0000001BHukIAG","2014-02-28T00:25:21.000Z","a0Z11000000D35iEAC","orange","The individual has responsibilities as a parent/caregiver and either the individual is struggling with these responsibilities or these issues are currently interfering with the individual?s functioning in other life domains.","2","2.0","PARENTING ROLES","false","",""
"a0Y110000008xrWEAQ","false","4402","2014-02-28T00:25:22.000Z","005U0000001BHukIAG","2014-02-28T00:25:22.000Z","005U0000001BHukIAG","2014-02-28T00:25:22.000Z","a0Z11000000D35iEAC","red","The individual has responsibilities as a parent/caregiver and the individual is currently unable to meet these responsibilities or these responsibilities are making it impossible for the individual to function in other life domains. Individual has the potential of abuse or neglect in his/her parenting.","3","6.0","PARENTING ROLES","false","",""
"a0Y110000008xrXEAQ","false","4403","2014-02-28T00:25:22.000Z","005U0000001BHukIAG","2014-02-28T00:25:22.000Z","005U0000001BHukIAG","2014-02-28T00:25:22.000Z","a0Z11000000D35iEAC","gray","Not applicable. Individual is not a caregiver/parent.","NA","0.0","PARENTING ROLES","false","",""
"a0Y110000008xrYEAQ","false","4404","2014-02-28T00:25:22.000Z","005U0000001BHukIAG","2014-02-28T00:25:22.000Z","005U0000001BHukIAG","2014-02-28T00:25:22.000Z","a0Z11000000D35IEAS","green","Child and biological mother had normal labor and delivery. A child who received an Apgar score of 7-10 at birth would be rated here.","0","0.0","LABOR AND DELIVERY","false","",""
"a0Y110000008xrZEAQ","false","4405","2014-02-28T00:25:22.000Z","005U0000001BHukIAG","2014-02-28T00:25:22.000Z","005U0000001BHukIAG","2014-02-28T00:25:22.000Z","a0Z11000000D35IEAS","yellow","Child or mother had some mild problems during delivery, but child does not appear to be affected by these problems. An emergency C-Section or a delivery-related physical injury (e.g., shoulder displacement) to the child would be rated here.","1","1.0","LABOR AND DELIVERY","false","",""
"a0Y110000008xraEAA","false","4406","2014-02-28T00:25:22.000Z","005U0000001BHukIAG","2014-02-28T00:25:22.000Z","005U0000001BHukIAG","2014-02-28T00:25:22.000Z","a0Z11000000D35IEAS","orange","Child or mother had problems during delivery that resulted in temporary functional difficulties for the child or mother. Extended fetal distress, postpartum hemorrhage, or uterine rupture would be rated here. A child who received an Apgar score of 4-7, or who needed some resuscitative measures at birth, would be rated here.","2","2.0","LABOR AND DELIVERY","false","",""
"a0Y110000008xrbEAA","false","4407","2014-02-28T00:25:22.000Z","005U0000001BHukIAG","2014-02-28T00:25:22.000Z","005U0000001BHukIAG","2014-02-28T00:25:22.000Z","a0Z11000000D35IEAS","red","Child had severe problems during delivery that have long-term implications for development (e.g., extensive oxygen deprivation, brain damage). A child who received an Apgar score of 3 or lower, or who needed immediate or extensive resuscitative measures at birth, would be rated here.","3","6.0","LABOR AND DELIVERY","false","",""
"a0Y110000008xrcEAA","false","4408","2014-02-28T00:25:22.000Z","005U0000001BHukIAG","2014-02-28T00:25:22.000Z","005U0000001BHukIAG","2014-02-28T00:25:22.000Z","a0Z11000000D35IEAS","gray","Unknown","U","0.0","LABOR AND DELIVERY","false","",""
"a0Y110000008xrdEAA","false","4409","2014-02-28T00:25:22.000Z","005U0000001BHukIAG","2014-02-28T00:25:22.000Z","005U0000001BHukIAG","2014-02-28T00:25:22.000Z","a0Z11000000D35IEAS","gray","Not applicable","NA","0.0","LABOR AND DELIVERY","false","",""
"a0Y110000008xreEAA","false","4410","2014-02-28T00:25:22.000Z","005U0000001BHukIAG","2014-02-28T00:25:22.000Z","005U0000001BHukIAG","2014-02-28T00:25:22.000Z","a0Z11000000D35jEAC","green","Adaptive partner relationship. Individual has a strong, positive, partner relationship with another adult, or they have maintained a positive partner relationship in the past but are not currently in an intimate relationship.","0","0.0","INTIMATE RELATIONSHIPS","false","",""
"a0Y110000008xrfEAA","false","4411","2014-02-28T00:25:22.000Z","005U0000001BHukIAG","2014-02-28T00:25:22.000Z","005U0000001BHukIAG","2014-02-28T00:25:22.000Z","a0Z11000000D35jEAC","yellow","Mostly adaptive partner relationship. Individual has a generally positive partner relationship with another individual. This relationship may, at times, impede the individual?s healthy development.","1","1.0","INTIMATE RELATIONSHIPS","false","",""
"a0Y110000008xrgEAA","false","4412","2014-02-28T00:25:23.000Z","005U0000001BHukIAG","2014-02-28T00:25:23.000Z","005U0000001BHukIAG","2014-02-28T00:25:23.000Z","a0Z11000000D35jEAC","orange","Limited adaptive partner relationship. For example, the individual has a recent history of being in a domestically violent relationship or a recent history of being in a relationship where he/she was overly dependent on his/her partner. Individual may or may not be currently involved in any partner relationship with another individual.","2","2.0","INTIMATE RELATIONSHIPS","false","",""
"a0Y110000008xrhEAA","false","4413","2014-02-28T00:25:23.000Z","005U0000001BHukIAG","2014-02-28T00:25:23.000Z","005U0000001BHukIAG","2014-02-28T00:25:23.000Z","a0Z11000000D35jEAC","red","Significant difficulties with partner relationships. For example, individual is currently involved in a negative or domestically violent relationship or a relationship where he/she is totally dependent on his/her partner.","3","6.0","INTIMATE RELATIONSHIPS","false","",""
"a0Y110000008xriEAA","false","4414","2014-02-28T00:25:23.000Z","005U0000001BHukIAG","2014-02-28T00:25:23.000Z","005U0000001BHukIAG","2014-02-28T00:25:23.000Z","a0Z11000000D35jEAC","gray","Not applicable","NA","0.0","INTIMATE RELATIONSHIPS","false","",""
"a0Y110000008xrjEAA","false","4415","2014-02-28T00:25:23.000Z","005U0000001BHukIAG","2014-02-28T00:25:23.000Z","005U0000001BHukIAG","2014-02-28T00:25:23.000Z","a0Z11000000D35JEAS","green","The child?s parents have no developmental disabilities. The child has no siblings, or existing siblings are not experiencing any developmental or behavioral problems","0","0.0","PARENT OR SIBLING PROBLEMS","false","",""
"a0Y110000008xrkEAA","false","4416","2014-02-28T00:25:23.000Z","005U0000001BHukIAG","2014-02-28T00:25:23.000Z","005U0000001BHukIAG","2014-02-28T00:25:23.000Z","a0Z11000000D35JEAS","yellow","The child?s parents have no developmental disabilities. The child has siblings who are experiencing some mild developmental or behavioral problems (e.g., Attention Deficit, Oppositional Defiant, or Conduct Disorders). It may be that child has at least one healthy sibling.","1","1.0","PARENT OR SIBLING PROBLEMS","false","",""
"a0Y110000008xrlEAA","false","4417","2014-02-28T00:25:23.000Z","005U0000001BHukIAG","2014-02-28T00:25:23.000Z","005U0000001BHukIAG","2014-02-28T00:25:23.000Z","a0Z11000000D35JEAS","orange","The child?s parents have no developmental disabilities. The child has a sibling who is experiencing a significant developmental or behavioral problem (e.g., a severe version of any of the disorders cited above, or any developmental disorder).","2","2.0","PARENT OR SIBLING PROBLEMS","false","",""
"a0Y110000008xrmEAA","false","4418","2014-02-28T00:25:23.000Z","005U0000001BHukIAG","2014-02-28T00:25:23.000Z","005U0000001BHukIAG","2014-02-28T00:25:23.000Z","a0Z11000000D35JEAS","red","One or both of the child?s parents have been diagnosed with a developmental disability, or the child has multiple siblings who are experiencing significant developmental or behavioral problems (all siblings must have some problems).","3","6.0","PARENT OR SIBLING PROBLEMS","false","",""
"a0Y110000008xrnEAA","false","4419","2014-02-28T00:25:23.000Z","005U0000001BHukIAG","2014-02-28T00:25:23.000Z","005U0000001BHukIAG","2014-02-28T00:25:23.000Z","a0Z11000000D35JEAS","gray","Unknown","U","0.0","PARENT OR SIBLING PROBLEMS","false","",""
"a0Y110000008xiAEAQ","false","3822","2014-02-28T00:24:44.000Z","005U0000001BHukIAG","2014-02-28T00:24:44.000Z","005U0000001BHukIAG","2014-02-28T00:24:44.000Z","a0Z11000000D32fEAC","","","Presents a Risk","","Harm to property","true","Description_of_Risk__c,Plan_to_reduce_Risk__c","1.0"
"a0Y110000008xiBEAQ","false","3823","2014-02-28T00:24:44.000Z","005U0000001BHukIAG","2014-02-28T00:24:44.000Z","005U0000001BHukIAG","2014-02-28T00:24:44.000Z","a0Z11000000D32fEAC","","","Does Not Present a Risk","","Harm to property","false","","2.0"
"a0Y110000008xiCEAQ","false","3824","2014-02-28T00:24:44.000Z","005U0000001BHukIAG","2014-02-28T00:24:44.000Z","005U0000001BHukIAG","2014-02-28T00:24:44.000Z","a0Z11000000D32gEAC","","","Presents a Risk","","Suicidal","true","Description_of_Risk__c,Plan_to_reduce_Risk__c","1.0"
"a0Y110000008xiDEAQ","false","3825","2014-02-28T00:24:44.000Z","005U0000001BHukIAG","2014-02-28T00:24:44.000Z","005U0000001BHukIAG","2014-02-28T00:24:44.000Z","a0Z11000000D32gEAC","","","Does Not Present a Risk","","Suicidal","false","","2.0"
"a0Y110000008xiEEAQ","false","3826","2014-02-28T00:24:44.000Z","005U0000001BHukIAG","2014-02-28T00:24:44.000Z","005U0000001BHukIAG","2014-02-28T00:24:44.000Z","a0Z11000000D32hEAC","","","Presents a Risk","","Elopement or AWOL","true","Description_of_Risk__c,Plan_to_reduce_Risk__c","1.0"
"a0Y110000008xiFEAQ","false","3827","2014-02-28T00:24:44.000Z","005U0000001BHukIAG","2014-02-28T00:24:44.000Z","005U0000001BHukIAG","2014-02-28T00:24:44.000Z","a0Z11000000D32hEAC","","","Does Not Present a Risk","","Elopement or AWOL","false","","2.0"
"a0Y110000008xiGEAQ","false","3828","2014-02-28T00:24:44.000Z","005U0000001BHukIAG","2014-02-28T00:24:44.000Z","005U0000001BHukIAG","2014-02-28T00:24:44.000Z","a0Z11000000D32iEAC","","","Presents a Risk","","Fire starter","true","Description_of_Risk__c,Plan_to_reduce_Risk__c","1.0"
"a0Y110000008xiHEAQ","false","3829","2014-02-28T00:24:44.000Z","005U0000001BHukIAG","2014-02-28T00:24:44.000Z","005U0000001BHukIAG","2014-02-28T00:24:44.000Z","a0Z11000000D32iEAC","","","Does Not Present a Risk","","Fire starter","false","","2.0"
"a0Y110000008xiIEAQ","false","3830","2014-02-28T00:24:44.000Z","005U0000001BHukIAG","2014-02-28T00:24:44.000Z","005U0000001BHukIAG","2014-02-28T00:24:44.000Z","a0Z11000000D32jEAC","","","Does Not Present a Risk","","Sex offender","false","","2.0"
"a0Y110000008xiJEAQ","false","3831","2014-02-28T00:24:44.000Z","005U0000001BHukIAG","2014-02-28T00:24:44.000Z","005U0000001BHukIAG","2014-02-28T00:24:44.000Z","a0Z11000000D32jEAC","","","Presents a Risk","","Sex offender","true","Description_of_Risk__c,Plan_to_reduce_Risk__c","1.0"
"a0Y110000008xjqEAA","false","3926","2014-02-28T00:24:50.000Z","005U0000001BHukIAG","2014-02-28T00:24:50.000Z","005U0000001BHukIAG","2014-02-28T00:24:50.000Z","a0Z11000000D330EAC","red","This rating is used to indicate a child with severe impairment of attention or concentration. A child with profound symptoms of ADHD or significant attention difficulties related to another diagnosis would be rated here.","3","6.0","ATTENTION/CONCENTRATION","false","",""
"a0Y110000008xjrEAA","false","3927","2014-02-28T00:24:50.000Z","005U0000001BHukIAG","2014-02-28T00:24:50.000Z","005U0000001BHukIAG","2014-02-28T00:24:50.000Z","a0Z11000000D331EAC","green","This rating is used to indicate a child with no evidence of age-inappropriate impulsivity in action or thought.","0","0.0","IMPULSIVITY","false","",""
"a0Y110000008xjsEAA","false","3928","2014-02-28T00:24:50.000Z","005U0000001BHukIAG","2014-02-28T00:24:50.000Z","005U0000001BHukIAG","2014-02-28T00:24:50.000Z","a0Z11000000D331EAC","yellow","This rating is used to indicate a child with evidence of mild levels of impulsivity evident in either action or thought. The child may behave in a fashion that suggests limited impulse control. For instance, child may yell out answers to questions or may have difficulty waiting his/her turn. Child may exhibit some motoric difficulties as well, for instance, pushing or shoving others without waiting turn.","1","1.0","IMPULSIVITY","false","",""
"a0Y110000008xjtEAA","false","3929","2014-02-28T00:24:50.000Z","005U0000001BHukIAG","2014-02-28T00:24:50.000Z","005U0000001BHukIAG","2014-02-28T00:24:50.000Z","a0Z11000000D331EAC","orange","This rating is used to indicate a child with moderate levels of impulsivity evident in behavior. The child is frequently impulsive and may represent a significant management problem. A child who often intrudes on others and often exhibits aggressive impulses would be rated here.","2","2.0","IMPULSIVITY","false","",""
"a0Y110000008xjuEAA","false","3930","2014-02-28T00:24:50.000Z","005U0000001BHukIAG","2014-02-28T00:24:50.000Z","005U0000001BHukIAG","2014-02-28T00:24:50.000Z","a0Z11000000D331EAC","red","This rating is used to indicate a child with significant levels of impulsivity evident in behavior. Frequent impulsive behavior is observed or noted that carries considerable safety risk (e.g., running into the street, dangerous driving, or bike riding). The child may be impulsive on a nearly continuous basis. He or she endangers self or others without thinking.","3","6.0","IMPULSIVITY","false","",""
"a0Y110000008xjvEAA","false","3931","2014-02-28T00:24:50.000Z","005U0000001BHukIAG","2014-02-28T00:24:50.000Z","005U0000001BHukIAG","2014-02-28T00:24:50.000Z","a0Z11000000D332EAC","green","This rating is given to a child with no emotional problems. No evidence of depression.","0","0.0","DEPRESSION","false","",""
"a0Y110000008xm2EAA","false","4062","2014-02-28T00:24:59.000Z","005U0000001BHukIAG","2014-02-28T00:24:59.000Z","005U0000001BHukIAG","2014-02-28T00:24:59.000Z","a0Z11000000D33OEAS","yellow","Moderate level of interpersonal strengths. Child may have a history of forming positive relationships with peers and/or non-caregivers. Child may have at least one healthy relationship, is friendly with others.","1","1.0","INTERPERSONAL","false","",""
"a0Y110000008xm3EAA","false","4063","2014-02-28T00:24:59.000Z","005U0000001BHukIAG","2014-02-28T00:24:59.000Z","005U0000001BHukIAG","2014-02-28T00:24:59.000Z","a0Z11000000D33OEAS","orange","Mild level of interpersonal strengths. Child has some social skills that facilitate positive relationships with peers and adults but may not have any current healthy friendships.","2","2.0","INTERPERSONAL","false","",""
"a0Y110000008xm4EAA","false","4064","2014-02-28T00:24:59.000Z","005U0000001BHukIAG","2014-02-28T00:24:59.000Z","005U0000001BHukIAG","2014-02-28T00:24:59.000Z","a0Z11000000D33OEAS","red","Very limited ability to make and maintain positive relationships. Child lacks social skills and has no history of positive relationships with peer and adults.","3","6.0","INTERPERSONAL","false","",""
"a0Y110000008xm5EAA","false","4065","2014-02-28T00:24:59.000Z","005U0000001BHukIAG","2014-02-28T00:24:59.000Z","005U0000001BHukIAG","2014-02-28T00:24:59.000Z","a0Z11000000D33pEAC","green","There is no evidence that child has witnessed or experienced violence in the community.","0","0.0","COMMUNITY VIOLENCE","false","",""
"a0Y110000008xm6EAA","false","4066","2014-02-28T00:24:59.000Z","005U0000001BHukIAG","2014-02-28T00:24:59.000Z","005U0000001BHukIAG","2014-02-28T00:24:59.000Z","a0Z11000000D33pEAC","yellow","Child has witnessed occasional fighting or other forms of violence in the community. Child has not been directly impacted by the community violence (i.e. violence not directed at self, family, or friends) and exposure has been limited.","1","1.0","COMMUNITY VIOLENCE","false","",""
"a0Y110000008xm7EAA","false","4067","2014-02-28T00:24:59.000Z","005U0000001BHukIAG","2014-02-28T00:24:59.000Z","005U0000001BHukIAG","2014-02-28T00:24:59.000Z","a0Z11000000D33pEAC","orange","Child has witnessed multiple instances of community violence and/or the significant injury of others in his/her community, or has had friends/family members injured as a result of violence or criminal activity in the community, or is the direct victim of violence/criminal activity that was not life threatening.","2","2.0","COMMUNITY VIOLENCE","false","",""
"a0Y110000008xm8EAA","false","4068","2014-02-28T00:24:59.000Z","005U0000001BHukIAG","2014-02-28T00:24:59.000Z","005U0000001BHukIAG","2014-02-28T00:24:59.000Z","a0Z11000000D33pEAC","red","Child has witnessed or experienced severe and repeated instances of community violence and/or the death of another person in his/her community as a result of violence, or is the direct victim of violence/criminal activity in the community that was life threatening, or has experienced chronic/ongoing impact as a result of community violence (e.g. family member injured and no longer able to work).","3","6.0","COMMUNITY VIOLENCE","false","",""
"a0Y110000008xm9EAA","false","4069","2014-02-28T00:24:59.000Z","005U0000001BHukIAG","2014-02-28T00:24:59.000Z","005U0000001BHukIAG","2014-02-28T00:24:59.000Z","a0Z11000000D33PEAS","green","This level indicates a child who is in school and is involved with an educational plan (or IEP) that appears to exceed expectations. School works exceptionally well with family and caregivers to create a special learning environment that meets the child?s needs. Someone at the school goes above and beyond to take a healthy interest in the educational success of the child.","0","0.0","EDUCATIONAL SETTING","false","",""
