"ID","ISDELETED","NAME","CREATEDDATE","CREATEDBYID","LASTMODIFIEDDATE","LASTMODIFIEDBYID","SYSTEMMODSTAMP","QUESTION__C","COLOR__C","RATING_DESCRIPTION__C","RATING__C","SCORE__C","QT__C","SHOW_EXTRA_FIELDS__C","SHOW_THESE_FIELDS__C","SORT_ORDER__C"
"a0Y110000008xsIEAQ","false","4450","2014-02-28T00:25:25.000Z","005U0000001BHukIAG","2014-02-28T00:25:25.000Z","005U0000001BHukIAG","2014-02-28T00:25:25.000Z","a0Z11000000D35OEAS","red","This level indicates a child who has significant problems in day care or preschool environments. Child may have recently been asked to stop attending.","3","6.0","DAY CARE PRESCHOOL","false","",""
"a0Y110000008xsJEAQ","false","4451","2014-02-28T00:25:25.000Z","005U0000001BHukIAG","2014-02-28T00:25:25.000Z","005U0000001BHukIAG","2014-02-28T00:25:25.000Z","a0Z11000000D35OEAS","gray","Not applicable","NA","0.0","DAY CARE PRESCHOOL","false","",""
"a0Y110000008xioEAA","false","3862","2014-02-28T00:24:47.000Z","005U0000001BHukIAG","2014-02-28T00:24:47.000Z","005U0000001BHukIAG","2014-02-28T00:24:47.000Z","a0Z11000000D32rEAC","yellow","This level indicates a caregiver(s) who is consistently involved in the planning and/or implementation of services for the child or adolescent but is not an active advocate on behalf of the child or adolescent.","1","1.0","INVOLVEMENT WITH CARE","false","",""
"a0Y110000008xipEAA","false","3863","2014-02-28T00:24:47.000Z","005U0000001BHukIAG","2014-02-28T00:24:47.000Z","005U0000001BHukIAG","2014-02-28T00:24:47.000Z","a0Z11000000D32rEAC","orange","This level indicates a caregiver(s) who is minimally involved in the care of the child or adolescent. Caregiver may visit individual when in out of home placement, but does not become involved in service planning and implementation.","2","2.0","INVOLVEMENT WITH CARE","false","",""
"a0Y110000008xiqEAA","false","3864","2014-02-28T00:24:47.000Z","005U0000001BHukIAG","2014-02-28T00:24:47.000Z","005U0000001BHukIAG","2014-02-28T00:24:47.000Z","a0Z11000000D32rEAC","red","This level indicates a caregiver(s) who is uninvolved with the care of the child or adolescent. Caregiver may want individual out-of-home or fails to visit individual when in residential placement.","3","6.0","INVOLVEMENT WITH CARE","false","",""
"a0Y110000008xirEAA","false","3865","2014-02-28T00:24:47.000Z","005U0000001BHukIAG","2014-02-28T00:24:47.000Z","005U0000001BHukIAG","2014-02-28T00:24:47.000Z","a0Z11000000D32rEAC","gray","Rate non applicable when the child has no known caregiver and/or when child is living in a residential or group home setting.","NA","0.0","INVOLVEMENT WITH CARE","false","",""
"a0Y110000008xisEAA","false","3866","2014-02-28T00:24:47.000Z","005U0000001BHukIAG","2014-02-28T00:24:47.000Z","005U0000001BHukIAG","2014-02-28T00:24:47.000Z","a0Z11000000D32sEAC","green","This level indicates that the present caregiver is fully knowledgeable about the child's psychological strengths and weaknesses, talents and limitations.","0","0.0","KNOWLEDGE","false","",""
"a0Y110000008xitEAA","false","3867","2014-02-28T00:24:47.000Z","005U0000001BHukIAG","2014-02-28T00:24:47.000Z","005U0000001BHukIAG","2014-02-28T00:24:47.000Z","a0Z11000000D32sEAC","yellow","This level indicates that the present caregiver, while being generally knowledgeable about the child, has some mild deficits in knowledge or understanding of either the child's psychological condition or his/her talents, skills and assets.","1","1.0","KNOWLEDGE","false","",""
"a0Y110000008xiuEAA","false","3868","2014-02-28T00:24:47.000Z","005U0000001BHukIAG","2014-02-28T00:24:47.000Z","005U0000001BHukIAG","2014-02-28T00:24:47.000Z","a0Z11000000D32sEAC","orange","This level indicates that the caregiver does not know or understand the child well and that significant deficits exist in the caregiver's ability to relate to the child's problems and strengths.","2","2.0","KNOWLEDGE","false","",""
"a0Y110000008xivEAA","false","3869","2014-02-28T00:24:47.000Z","005U0000001BHukIAG","2014-02-28T00:24:47.000Z","005U0000001BHukIAG","2014-02-28T00:24:47.000Z","a0Z11000000D32sEAC","red","This level indicates that the present caregiver has little or no understanding of the child's current condition. The placement is unable to cope with the child given his/her status at the time, not because of the needs of the child but because the caregiver does not understand or accept the situation.","3","6.0","KNOWLEDGE","false","",""
"a0Y110000008xiwEAA","false","3870","2014-02-28T00:24:47.000Z","005U0000001BHukIAG","2014-02-28T00:24:47.000Z","005U0000001BHukIAG","2014-02-28T00:24:47.000Z","a0Z11000000D32sEAC","gray","Rate non applicable when the child has no known caregiver and/or when child is living in a residential or group home setting.","NA","0.0","KNOWLEDGE","false","",""
"a0Y110000008xixEAA","false","3871","2014-02-28T00:24:47.000Z","005U0000001BHukIAG","2014-02-28T00:24:47.000Z","005U0000001BHukIAG","2014-02-28T00:24:47.000Z","a0Z11000000D32tEAC","green","Caregiver(s) is well organized and efficient.","0","0.0","ORGANIZATION","false","",""
"a0Y110000008xjwEAA","false","3932","2014-02-28T00:24:51.000Z","005U0000001BHukIAG","2014-02-28T00:24:51.000Z","005U0000001BHukIAG","2014-02-28T00:24:51.000Z","a0Z11000000D332EAC","yellow","This rating is given to a child with mild emotional problems. Brief duration of depression, irritability, or impairment of peer, family, or academic functioning that does not lead to gross avoidance behavior.","1","1.0","DEPRESSION","false","",""
"a0Y110000008xjxEAA","false","3933","2014-02-28T00:24:51.000Z","005U0000001BHukIAG","2014-02-28T00:24:51.000Z","005U0000001BHukIAG","2014-02-28T00:24:51.000Z","a0Z11000000D332EAC","orange","This rating is given to a child with a moderate level of emotional disturbance. Any diagnosis of depression would be coded here. This level is used to rate children who meet the criteria for an affective disorder listed above.","2","2.0","DEPRESSION","false","",""
"a0Y110000008xjyEAA","false","3934","2014-02-28T00:24:51.000Z","005U0000001BHukIAG","2014-02-28T00:24:51.000Z","005U0000001BHukIAG","2014-02-28T00:24:51.000Z","a0Z11000000D332EAC","red","This rating is given to a child with a severe level of depression. This would include a child who stays at home or in bed all day due to depression or one whose emotional symptoms prevent any participation in school, friendship groups, or family life. Disabling forms of depressive diagnoses would be coded here. This level is used to indicate a extreme case of one of the disorders listed above.","3","6.0","DEPRESSION","false","",""
"a0Y110000008xjzEAA","false","3935","2014-02-28T00:24:51.000Z","005U0000001BHukIAG","2014-02-28T00:24:51.000Z","005U0000001BHukIAG","2014-02-28T00:24:51.000Z","a0Z11000000D333EAC","green","No evidence of any anxiety or fearfulness.","0","0.0","ANXIETY","false","",""
"a0Y110000008xk0EAA","false","3936","2014-02-28T00:24:51.000Z","005U0000001BHukIAG","2014-02-28T00:24:51.000Z","005U0000001BHukIAG","2014-02-28T00:24:51.000Z","a0Z11000000D333EAC","yellow","History or suspicion of anxiety problems or mild to moderate anxiety associated with a recent negative life event. This level is used to rate either a mild phobia or anxiety problem or a sub-threshold level of symptoms for the other listed disorders.","1","1.0","ANXIETY","false","",""
"a0Y110000008xk1EAA","false","3937","2014-02-28T00:24:51.000Z","005U0000001BHukIAG","2014-02-28T00:24:51.000Z","005U0000001BHukIAG","2014-02-28T00:24:51.000Z","a0Z11000000D333EAC","orange","Clear evidence of anxiety associated with either anxious mood or significant fearfulness. Anxiety has interfered significantly in child?s ability to function in at least one life domain.","2","2.0","ANXIETY","false","",""
"a0Y110000008xjIEAQ","false","3892","2014-02-28T00:24:48.000Z","005U0000001BHukIAG","2014-02-28T00:24:48.000Z","005U0000001BHukIAG","2014-02-28T00:24:48.000Z","a0Z11000000D32wEAC","orange","This level indicates that the present placement environment presents a moderate level of risk to the child, including such things as the risk of neglect or abuse or exposure to individuals who could harm the child.","2","2.0","SAFETY","false","",""
"a0Y110000008xjJEAQ","false","3893","2014-02-28T00:24:48.000Z","005U0000001BHukIAG","2014-02-28T00:24:48.000Z","005U0000001BHukIAG","2014-02-28T00:24:48.000Z","a0Z11000000D32wEAC","red","This level indicates that the present placement environment presents a significant risk to the well being of the child. Risk of neglect or abuse is imminent and immediate. Individuals in the environment offer the potential of significantly harming the child.","3","6.0","SAFETY","false","",""
"a0Y110000008xjKEAQ","false","3894","2014-02-28T00:24:48.000Z","005U0000001BHukIAG","2014-02-28T00:24:48.000Z","005U0000001BHukIAG","2014-02-28T00:24:48.000Z","a0Z11000000D32wEAC","gray","Rate non applicable when the child has no known caregiver and/or when child is living in a residential or group home setting.","NA","0.0","SAFETY","false","",""
"a0Y110000008xjLEAQ","false","3895","2014-02-28T00:24:48.000Z","005U0000001BHukIAG","2014-02-28T00:24:48.000Z","005U0000001BHukIAG","2014-02-28T00:24:48.000Z","a0Z11000000D32WEAS","green","Child has clear and consistent cultural identity and is connected to others who share his/her cultural identity.","0","0.0","IDENTITY","false","",""
"a0Y110000008xjMEAQ","false","3896","2014-02-28T00:24:48.000Z","005U0000001BHukIAG","2014-02-28T00:24:48.000Z","005U0000001BHukIAG","2014-02-28T00:24:48.000Z","a0Z11000000D32WEAS","yellow","Child is experiencing some confusion or concern regarding his/her cultural identity.","1","1.0","IDENTITY","false","",""
"a0Y110000008xjNEAQ","false","3897","2014-02-28T00:24:48.000Z","005U0000001BHukIAG","2014-02-28T00:24:48.000Z","005U0000001BHukIAG","2014-02-28T00:24:48.000Z","a0Z11000000D32WEAS","orange","Child has significant struggles with his/her own cultural identity. Child may have cultural identity but is not connected with others who share this culture.","2","2.0","IDENTITY","false","",""
"a0Y110000008xjOEAQ","false","3898","2014-02-28T00:24:48.000Z","005U0000001BHukIAG","2014-02-28T00:24:48.000Z","005U0000001BHukIAG","2014-02-28T00:24:48.000Z","a0Z11000000D32WEAS","red","Child has no connection to his/her cultural identity or is experiencing significant problems due to internal conflict regarding his/her cultural identity.","3","6.0","IDENTITY","false","",""
"a0Y110000008xjPEAQ","false","3899","2014-02-28T00:24:48.000Z","005U0000001BHukIAG","2014-02-28T00:24:48.000Z","005U0000001BHukIAG","2014-02-28T00:24:48.000Z","a0Z11000000D32xEAC","green","Caregivers appear to be functioning adequately. There is no evidence of notable conflict in the caregiver relationship. Disagreements are handled in an atmosphere of mutual respect and equal power.","0","0.0","MARITAL/PARTNER VIOLENCE","false","",""
"a0Y110000008xjQEAQ","false","3900","2014-02-28T00:24:48.000Z","005U0000001BHukIAG","2014-02-28T00:24:48.000Z","005U0000001BHukIAG","2014-02-28T00:24:48.000Z","a0Z11000000D32xEAC","yellow","Mild to moderate level of family problems including marital difficulties and caregiver arguments. Caregivers are generally able to keep arguments to a minimum when child is present. Occasional difficulties in conflict resolution or use of power and control by one partner over another.","1","1.0","MARITAL/PARTNER VIOLENCE","false","",""
"a0Y110000008xjREAQ","false","3901","2014-02-28T00:24:48.000Z","005U0000001BHukIAG","2014-02-28T00:24:48.000Z","005U0000001BHukIAG","2014-02-28T00:24:48.000Z","a0Z11000000D32xEAC","orange","Significant level of caregiver difficulties including frequent arguments that often escalate to verbal aggression or the use of verbal aggression by one partner to control the other. Child often witnesses these arguments between caregivers or the use of verbal aggression by one partner to control the other.","2","2.0","MARITAL/PARTNER VIOLENCE","false","",""
"a0Y110000008xk6EAA","false","3942","2014-02-28T00:24:51.000Z","005U0000001BHukIAG","2014-02-28T00:24:51.000Z","005U0000001BHukIAG","2014-02-28T00:24:51.000Z","a0Z11000000D334EAC","red","This rating indicates that the child/adolescent has severe problems with compliance with rules or adult instructions. A child rated at this level would be a severe case of Oppositional Defiant Disorder. They would be virtually always noncompliant. Child repeatedly ignores authority.","3","6.0","OPPOSITIONAL BEHAVIOR (Compliance with authority)","false","",""
"a0Y110000008xk7EAA","false","3943","2014-02-28T00:24:51.000Z","005U0000001BHukIAG","2014-02-28T00:24:51.000Z","005U0000001BHukIAG","2014-02-28T00:24:51.000Z","a0Z11000000D335EAC","green","This rating indicates a child with no evidence of behavior disorder.","0","0.0","CONDUCT","false","",""
"a0Y110000008xk8EAA","false","3944","2014-02-28T00:24:51.000Z","005U0000001BHukIAG","2014-02-28T00:24:51.000Z","005U0000001BHukIAG","2014-02-28T00:24:51.000Z","a0Z11000000D335EAC","yellow","This rating indicates a child with a mild level of conduct problems. The child may have some difficulties in school and home behavior. Problems are recognizable but not notably deviant for age, sex, and community. This might include occasional truancy, repeated severe lying, or petty theft from family.","1","1.0","CONDUCT","false","",""
"a0Y110000008xk9EAA","false","3945","2014-02-28T00:24:51.000Z","005U0000001BHukIAG","2014-02-28T00:24:51.000Z","005U0000001BHukIAG","2014-02-28T00:24:51.000Z","a0Z11000000D335EAC","orange","This rating indicates a child with a moderate level of conduct disorder. This could include episodes of planned aggressive or other anti-social behavior. A child rated at this level should meet the criteria for a diagnosis of Conduct Disorder.","2","2.0","CONDUCT","false","",""
"a0Y110000008xkAEAQ","false","3946","2014-02-28T00:24:51.000Z","005U0000001BHukIAG","2014-02-28T00:24:51.000Z","005U0000001BHukIAG","2014-02-28T00:24:51.000Z","a0Z11000000D335EAC","red","This rating indicates a child with a severe Conduct Disorder. This could include frequent episodes of unprovoked, planned aggressive or other anti-social behavior.","3","6.0","CONDUCT","false","",""
"a0Y110000008xkBEAQ","false","3947","2014-02-28T00:24:51.000Z","005U0000001BHukIAG","2014-02-28T00:24:51.000Z","005U0000001BHukIAG","2014-02-28T00:24:51.000Z","a0Z11000000D336EAC","green","This rating is for a child who has no substance use difficulties at the present time. If the person is in recovery for greater than 1 year, they should be coded here, although this is unlikely for a child or adolescent.","0","0.0","SUBSTANCE ABUSE","false","",""
"a0Y110000008xkCEAQ","false","3948","2014-02-28T00:24:51.000Z","005U0000001BHukIAG","2014-02-28T00:24:51.000Z","005U0000001BHukIAG","2014-02-28T00:24:51.000Z","a0Z11000000D336EAC","yellow","This rating is for a child with mild substance use problems that might occasionally present problems for the person (intoxication, loss of money, reduced school performance, parental concern). This rating would be used for someone early in recovery (less than 1 year) who is currently abstinent for at least 30 days.","1","1.0","SUBSTANCE ABUSE","false","",""
"a0Y110000008xkDEAQ","false","3949","2014-02-28T00:24:51.000Z","005U0000001BHukIAG","2014-02-28T00:24:51.000Z","005U0000001BHukIAG","2014-02-28T00:24:51.000Z","a0Z11000000D336EAC","orange","This rating is for a child with a moderate substance abuse problem that impairs his/her ability to function, but does not preclude functioning in an unstructured setting while participating in treatment.","2","2.0","SUBSTANCE ABUSE","false","",""
"a0Y110000008xkEEAQ","false","3950","2014-02-28T00:24:51.000Z","005U0000001BHukIAG","2014-02-28T00:24:51.000Z","005U0000001BHukIAG","2014-02-28T00:24:51.000Z","a0Z11000000D336EAC","red","This rating is for a child with a severe substance dependence condition that consistently impairs his/her ability to function. Substance abuse problems may present significant complications to the coordination of care for the individual. A substance-exposed infant who demonstrates symptoms of substance dependence would also be rated here.","3","6.0","SUBSTANCE ABUSE","false","",""
"a0Y110000008xkFEAQ","false","3951","2014-02-28T00:24:51.000Z","005U0000001BHukIAG","2014-02-28T00:24:51.000Z","005U0000001BHukIAG","2014-02-28T00:24:51.000Z","a0Z11000000D337EAC","green","No evidence of attachment problems. Caregiver-child relationship is characterized by mutual satisfaction of needs and child's development of a sense of security and trust. Caregiver appears able to respond to child cues in a consistent, appropriate manner, and child seeks age-appropriate contact with caregiver for both nurturing and safety needs.","0","0.0","ATTACHMENT DIFFICULTIES","false","",""
"a0Y110000008xkuEAA","false","3992","2014-02-28T00:24:55.000Z","005U0000001BHukIAG","2014-02-28T00:24:55.000Z","005U0000001BHukIAG","2014-02-28T00:24:55.000Z","a0Z11000000D33EEAS","red","Engaged in behavior other than suicide or self-mutilation that places him/her at immediate risk of death. This includes reckless behavior or intentional risk-taking behavior.","3","6.0","OTHER SELF HARM","false","",""
"a0Y110000008xkvEAA","false","3993","2014-02-28T00:24:55.000Z","005U0000001BHukIAG","2014-02-28T00:24:55.000Z","005U0000001BHukIAG","2014-02-28T00:24:55.000Z","a0Z11000000D33fEAC","","","Presents a Risk","","Exhibits socially accepted behaviors in public","true","Description_of_Risk__c,Plan_to_reduce_Risk__c","1.0"
"a0Y110000008xkwEAA","false","3994","2014-02-28T00:24:55.000Z","005U0000001BHukIAG","2014-02-28T00:24:55.000Z","005U0000001BHukIAG","2014-02-28T00:24:55.000Z","a0Z11000000D33fEAC","","","Does Not Present a Risk","","Exhibits socially accepted behaviors in public","false","","2.0"
"a0Y110000008xkxEAA","false","3995","2014-02-28T00:24:55.000Z","005U0000001BHukIAG","2014-02-28T00:24:55.000Z","005U0000001BHukIAG","2014-02-28T00:24:55.000Z","a0Z11000000D33FEAS","green","Child has no evidence or history of aggressive behaviors or significant verbal aggression towards others (including people and animals).","0","0.0","DANGER TO OTHERS","false","",""
"a0Y110000008xkyEAA","false","3996","2014-02-28T00:24:55.000Z","005U0000001BHukIAG","2014-02-28T00:24:55.000Z","005U0000001BHukIAG","2014-02-28T00:24:55.000Z","a0Z11000000D33FEAS","yellow","History of aggressive behavior or verbal aggression towards others but no aggression during the past 30 days. History of fire setting (not in past year) would be rated here.","1","1.0","DANGER TO OTHERS","false","",""
"a0Y110000008xkzEAA","false","3997","2014-02-28T00:24:55.000Z","005U0000001BHukIAG","2014-02-28T00:24:55.000Z","005U0000001BHukIAG","2014-02-28T00:24:55.000Z","a0Z11000000D33FEAS","orange","Occasional or moderate level of aggression towards others including aggression during the past 30 days or more recent verbal aggression.","2","2.0","DANGER TO OTHERS","false","",""
"a0Y110000008xl0EAA","false","3998","2014-02-28T00:24:55.000Z","005U0000001BHukIAG","2014-02-28T00:24:55.000Z","005U0000001BHukIAG","2014-02-28T00:24:55.000Z","a0Z11000000D33FEAS","red","Frequent or dangerous (significant harm) level of aggression to others. Child or youth is an immediate risk to others.","3","6.0","DANGER TO OTHERS","false","",""
"a0Y110000008xl1EAA","false","3999","2014-02-28T00:24:55.000Z","005U0000001BHukIAG","2014-02-28T00:24:55.000Z","005U0000001BHukIAG","2014-02-28T00:24:55.000Z","a0Z11000000D33gEAC","","","Presents a Risk","","Demonstrates water safety skills","true","Description_of_Risk__c,Plan_to_reduce_Risk__c","1.0"
"a0Y110000008xl2EAA","false","4000","2014-02-28T00:24:55.000Z","005U0000001BHukIAG","2014-02-28T00:24:55.000Z","005U0000001BHukIAG","2014-02-28T00:24:55.000Z","a0Z11000000D33gEAC","","","Does Not Present a Risk","","Demonstrates water safety skills","false","","2.0"
"a0Y110000008xl3EAA","false","4001","2014-02-28T00:24:55.000Z","005U0000001BHukIAG","2014-02-28T00:24:55.000Z","005U0000001BHukIAG","2014-02-28T00:24:55.000Z","a0Z11000000D33GEAS","green","No evidence of problems with sexual behavior in the past year.","0","0.0","SEXUAL AGGRESSION","false","",""
"a0Y110000008xmCEAQ","false","4072","2014-02-28T00:25:00.000Z","005U0000001BHukIAG","2014-02-28T00:25:00.000Z","005U0000001BHukIAG","2014-02-28T00:25:00.000Z","a0Z11000000D33PEAS","red","This level indicates a child who is either not in school or is in a school setting that does not further his/her education.","3","6.0","EDUCATIONAL SETTING","false","",""
"a0Y110000008xmDEAQ","false","4073","2014-02-28T00:25:00.000Z","005U0000001BHukIAG","2014-02-28T00:25:00.000Z","005U0000001BHukIAG","2014-02-28T00:25:00.000Z","a0Z11000000D33PEAS","gray","This item is only rated not applicable when a child is not in a school or preschool setting.","NA","0.0","EDUCATIONAL SETTING","false","",""
"a0Y110000008xmEEAQ","false","4074","2014-02-28T00:25:00.000Z","005U0000001BHukIAG","2014-02-28T00:25:00.000Z","005U0000001BHukIAG","2014-02-28T00:25:00.000Z","a0Z11000000D33qEAC","green","There is no evidence that child has witnessed violence in the school setting.","0","0.0","SCHOOL VIOLENCE","false","",""
"a0Y110000008xmFEAQ","false","4075","2014-02-28T00:25:00.000Z","005U0000001BHukIAG","2014-02-28T00:25:00.000Z","005U0000001BHukIAG","2014-02-28T00:25:00.000Z","a0Z11000000D33qEAC","yellow","Child has witnessed occasional fighting or other forms of violence in the school setting. Child has not been directly impacted by the violence (i. e. violence not directed at self or close friends) and exposure has been limited.","1","1.0","SCHOOL VIOLENCE","false","",""
"a0Y110000008xmGEAQ","false","4076","2014-02-28T00:25:00.000Z","005U0000001BHukIAG","2014-02-28T00:25:00.000Z","005U0000001BHukIAG","2014-02-28T00:25:00.000Z","a0Z11000000D33qEAC","orange","Child has witnessed multiple instances of school violence and/or the significant injury of others in his/her school setting, or has had friends injured as a result of violence or criminal activity in the school setting, or has directly experienced violence in the school setting leading to minor injury.","2","2.0","SCHOOL VIOLENCE","false","",""
"a0Y110000008xmHEAQ","false","4077","2014-02-28T00:25:00.000Z","005U0000001BHukIAG","2014-02-28T00:25:00.000Z","005U0000001BHukIAG","2014-02-28T00:25:00.000Z","a0Z11000000D33qEAC","red","Child has witnessed repeated and severe instances of school violence and/or the death of another person in his/her school setting, or has had friends who were seriously injured as a result of violence or criminal activity in the school setting, or has directly experienced violence in the school setting leading to significant injury or lasting impact.","3","6.0","SCHOOL VIOLENCE","false","",""
"a0Y110000008xmIEAQ","false","4078","2014-02-28T00:25:00.000Z","005U0000001BHukIAG","2014-02-28T00:25:00.000Z","005U0000001BHukIAG","2014-02-28T00:25:00.000Z","a0Z11000000D33QEAS","green","This level indicates an adolescent with vocational skills who is currently working in a natural environment.","0","0.0","VOCATIONAL","false","",""
"a0Y110000008xmJEAQ","false","4079","2014-02-28T00:25:00.000Z","005U0000001BHukIAG","2014-02-28T00:25:00.000Z","005U0000001BHukIAG","2014-02-28T00:25:00.000Z","a0Z11000000D33QEAS","yellow","This level indicates an adolescent with pre-vocational and some vocational skills but limited work experience.","1","1.0","VOCATIONAL","false","",""
"a0Y110000008xmKEAQ","false","4080","2014-02-28T00:25:00.000Z","005U0000001BHukIAG","2014-02-28T00:25:00.000Z","005U0000001BHukIAG","2014-02-28T00:25:00.000Z","a0Z11000000D33QEAS","orange","This level indicates an adolescent with some pre-vocational skills but who is not presently working in any area related to those skills. This also may indicate a child or youth with a clear vocational preference.","2","2.0","VOCATIONAL","false","",""
"a0Y110000008xmLEAQ","false","4081","2014-02-28T00:25:00.000Z","005U0000001BHukIAG","2014-02-28T00:25:00.000Z","005U0000001BHukIAG","2014-02-28T00:25:00.000Z","a0Z11000000D33QEAS","red","This level indicates an adolescent with no known or identifiable vocational or pre-vocational skills and no expression of any future vocational preferences.","3","6.0","VOCATIONAL","false","",""
"a0Y110000008xmMEAQ","false","4082","2014-02-28T00:25:00.000Z","005U0000001BHukIAG","2014-02-28T00:25:00.000Z","005U0000001BHukIAG","2014-02-28T00:25:00.000Z","a0Z11000000D33QEAS","gray","This item can be rated not applicable when a child is under 14 years old.","NA","0.0","VOCATIONAL","false","",""
"a0Y110000008xmNEAQ","false","4083","2014-02-28T00:25:00.000Z","005U0000001BHukIAG","2014-02-28T00:25:00.000Z","005U0000001BHukIAG","2014-02-28T00:25:00.000Z","a0Z11000000D33rEAC","green","There is no evidence that child has been exposed to natural or man-made disasters.","0","0.0","NATURAL OR MANMADE DISASTERS","false","",""
"a0Y110000008xmOEAQ","false","4084","2014-02-28T00:25:00.000Z","005U0000001BHukIAG","2014-02-28T00:25:00.000Z","005U0000001BHukIAG","2014-02-28T00:25:00.000Z","a0Z11000000D33rEAC","yellow","Child has been exposed to disasters second-hand (i.e. on television, hearing others discuss disasters). This would include second-hand exposure to natural disasters such as a fire or earthquake or manmade disaster, including car accident, plane crashes, or bombings.","1","1.0","NATURAL OR MANMADE DISASTERS","false","",""
"a0Y110000008xmPEAQ","false","4085","2014-02-28T00:25:00.000Z","005U0000001BHukIAG","2014-02-28T00:25:00.000Z","005U0000001BHukIAG","2014-02-28T00:25:00.000Z","a0Z11000000D33rEAC","orange","Child has been directly exposed to a disaster or witnessed the impact of a disaster on a family or friend. For instance, a child may observe a caregiver who has been injured in a car accident or fire or watch his neighbor?s house burn down.","2","2.0","NATURAL OR MANMADE DISASTERS","false","",""
